[
  {
    "id": "A1-G01",
    "level": "A1",
    "title": "문장뼈대(SVC/SVO)",
    "prerequisite": null,
    "difficultyTag": "core",
    "canDo": [
      "문장에서 주어, 동사, 목적어와 보어를 구분할 수 있다.",
      "SVC와 SVO 어순으로 기본 문장을 만들 수 있다.",
      "단수와 복수 주어에 맞는 동사를 선택할 수 있다."
    ],
    "summary": "영어 문장의 중심인 주어와 동사를 기준으로 SVC와 SVO의 기본 어순을 익힌다.",
    "patterns": [
      "S + linking verb + C",
      "S + transitive verb + O"
    ],
    "examples": [
      "The soup smells wonderful.",
      "My brother reads science magazines."
    ],
    "errorCodes": ["WO-01", "SV-01"],
    "masteryRule": {
      "quizAccuracy": 0.8,
      "productionPass": true,
      "errorTolerance": 0.2
    }
  },
  {
    "id": "A1-G02",
    "level": "A1",
    "title": "be동사/일반동사 현재 + 부정/의문 + WH-질문 기초",
    "prerequisite": "A1-G01",
    "difficultyTag": "core",
    "canDo": [
      "be동사와 일반동사의 현재형을 알맞게 선택할 수 있다.",
      "do 또는 does를 사용해 부정문과 예·아니오 의문문을 만들 수 있다.",
      "who, what, where, when을 사용해 기본 정보 질문을 할 수 있다."
    ],
    "summary": "be동사와 일반동사의 현재형을 구별하고 평서문을 부정문과 여러 질문으로 바꾼다.",
    "patterns": [
      "S + am/is/are + C / Am/Is/Are + S + C?",
      "S + do/does not + V / Do/Does + S + V?",
      "WH-word + do/does + S + V?"
    ],
    "examples": [
      "Mina is at home, but her parents are not there.",
      "Where does your cousin work?"
    ],
    "errorCodes": ["TENSE-01", "SV-02", "WO-02"],
    "masteryRule": {
      "quizAccuracy": 0.8,
      "productionPass": true,
      "errorTolerance": 0.2
    }
  },
  {
    "id": "A1-G03",
    "level": "A1",
    "title": "there is/are + 명사 복수",
    "prerequisite": "A1-G02",
    "difficultyTag": "core",
    "canDo": [
      "새로 소개하는 사람이나 사물의 존재를 there is 또는 there are로 말할 수 있다.",
      "뒤따르는 명사의 단수와 복수에 맞춰 be동사를 선택할 수 있다.",
      "존재문의 부정형과 의문형을 만들 수 있다."
    ],
    "summary": "there is와 there are를 사용해 장소에 존재하는 사람이나 사물을 수에 맞게 소개한다.",
    "patterns": [
      "There is + a/an + singular noun + place phrase",
      "There are + plural noun + place phrase",
      "Is/Are there + noun + place phrase?"
    ],
    "examples": [
      "There is a pharmacy across the street.",
      "Are there any clean cups in the kitchen?"
    ],
    "errorCodes": ["SV-03", "ART-01"],
    "masteryRule": {
      "quizAccuracy": 0.8,
      "productionPass": true,
      "errorTolerance": 0.2
    }
  },
  {
    "id": "A1-G04",
    "level": "A1",
    "title": "현재진행/단순과거 기초",
    "prerequisite": "A1-G03",
    "difficultyTag": "core",
    "canDo": [
      "지금 진행 중인 행동을 현재진행형으로 표현할 수 있다.",
      "끝난 과거 행동을 규칙 또는 핵심 불규칙 과거형으로 말할 수 있다.",
      "현재와 과거를 나타내는 시간 표현에 맞춰 시제를 선택할 수 있다."
    ],
    "summary": "지금 일어나는 행동과 이미 끝난 행동을 현재진행형과 단순과거로 구별한다.",
    "patterns": [
      "S + am/is/are + V-ing",
      "S + V-ed / irregular past form",
      "Did + S + base verb?"
    ],
    "examples": [
      "The children are building a sandcastle now.",
      "We took the train to Busan yesterday."
    ],
    "errorCodes": ["TENSE-01", "TENSE-02"],
    "masteryRule": {
      "quizAccuracy": 0.8,
      "productionPass": true,
      "errorTolerance": 0.2
    }
  },
  {
    "id": "A1-G05",
    "level": "A1",
    "title": "인칭/소유/목적격 대명사",
    "prerequisite": "A1-G04",
    "difficultyTag": "core",
    "canDo": [
      "문장 주어 자리에서 알맞은 주격 대명사를 사용할 수 있다.",
      "동사나 전치사 뒤에서 알맞은 목적격 대명사를 사용할 수 있다.",
      "소유형용사와 소유대명사를 구별해 소유 관계를 표현할 수 있다."
    ],
    "summary": "대명사의 문장 내 역할을 구별해 주격, 목적격, 소유형용사와 소유대명사를 정확히 쓴다.",
    "patterns": [
      "Subject pronoun + V + object pronoun",
      "Possessive adjective + noun / noun + be + possessive pronoun"
    ],
    "examples": [
      "She called me after class.",
      "This is our table, and that one is theirs."
    ],
    "errorCodes": ["WO-03", "SV-01"],
    "masteryRule": {
      "quizAccuracy": 0.8,
      "productionPass": true,
      "errorTolerance": 0.2
    }
  },
  {
    "id": "A1-G06",
    "level": "A1",
    "title": "관사/지시사/기본 전치사",
    "prerequisite": "A1-G05",
    "difficultyTag": "core",
    "canDo": [
      "처음 언급하는 단수 가산명사에 a 또는 an을 붙일 수 있다.",
      "특정 대상을 the와 this, that, these, those로 가리킬 수 있다.",
      "시간과 장소에 맞는 in, on, at을 선택할 수 있다."
    ],
    "summary": "관사와 지시사로 명사의 범위를 정하고 기본 전치사로 시간과 장소를 연결한다.",
    "patterns": [
      "a/an + singular count noun / the + specific noun",
      "this/that + singular noun / these/those + plural noun",
      "at + time / on + day / in + month or place"
    ],
    "examples": [
      "I saw a dog in the park, and the dog followed me.",
      "These keys are on the desk beside that lamp."
    ],
    "errorCodes": ["ART-01", "PREP-01"],
    "masteryRule": {
      "quizAccuracy": 0.8,
      "productionPass": true,
      "errorTolerance": 0.2
    }
  },
  {
    "id": "A1-G07",
    "level": "A1",
    "title": "can/can't + 명령문",
    "prerequisite": "A1-G06",
    "difficultyTag": "core",
    "canDo": [
      "can과 can't로 능력과 허가를 표현할 수 있다.",
      "Can I 또는 Can you로 허가와 요청을 묻고 답할 수 있다.",
      "동사원형으로 긍정 명령문과 부정 명령문을 만들 수 있다."
    ],
    "summary": "can을 이용해 능력, 허가와 요청을 말하고 동사원형으로 간단한 지시를 한다.",
    "patterns": [
      "S + can/can't + base verb",
      "Can + S + base verb?",
      "Base verb + object / Don't + base verb"
    ],
    "examples": [
      "Can I borrow your umbrella?",
      "Please close the window, but don't lock it."
    ],
    "errorCodes": ["MODAL-01", "WO-04"],
    "masteryRule": {
      "quizAccuracy": 0.8,
      "productionPass": true,
      "errorTolerance": 0.2
    }
  },
  {
    "id": "A1-G08",
    "level": "A1",
    "title": "and/but/because + 빈도부사",
    "prerequisite": "A1-G07",
    "difficultyTag": "core",
    "canDo": [
      "and, but, because로 정보의 추가, 대조와 이유를 연결할 수 있다.",
      "always, usually, often, sometimes, never로 빈도를 말할 수 있다.",
      "빈도부사를 be동사와 일반동사에 맞는 위치에 놓을 수 있다."
    ],
    "summary": "기본 접속사로 짧은 문장을 연결하고 빈도부사의 위치로 일상의 반복 정도를 나타낸다.",
    "patterns": [
      "clause + and/but/because + clause",
      "S + frequency adverb + main verb",
      "S + be + frequency adverb + C"
    ],
    "examples": [
      "I usually walk to work, but I take the bus when it rains.",
      "Leo is often tired because he goes to bed late."
    ],
    "errorCodes": ["CLAUSE-01", "WO-05"],
    "masteryRule": {
      "quizAccuracy": 0.8,
      "productionPass": true,
      "errorTolerance": 0.2
    }
  },
  {
    "id": "A2-G01",
    "level": "A2",
    "title": "미래(will/be going to) + 계획/의도",
    "prerequisite": "A1-G08",
    "difficultyTag": "expansion",
    "canDo": [
      "즉석 결정과 예측에 will을 사용할 수 있다.",
      "미리 세운 계획과 근거 있는 예측에 be going to를 사용할 수 있다.",
      "미래 계획과 의도를 부정문과 의문문으로 주고받을 수 있다."
    ],
    "summary": "상황에 따라 will과 be going to를 선택해 미래의 결정, 예측과 계획을 표현한다.",
    "patterns": [
      "S + will + base verb",
      "S + am/is/are going to + base verb",
      "Will + S + base verb?"
    ],
    "examples": [
      "I'll answer the phone.",
      "We are going to visit Jeju during the school break."
    ],
    "errorCodes": ["TENSE-04", "MODAL-02"],
    "masteryRule": {
      "quizAccuracy": 0.8,
      "productionPass": true,
      "errorTolerance": 0.2
    }
  },
  {
    "id": "A2-G02",
    "level": "A2",
    "title": "현재완료(have p.p.) + since/for/just/already/yet",
    "prerequisite": "A2-G01",
    "difficultyTag": "expansion",
    "canDo": [
      "경험, 결과와 계속되는 상태를 현재완료로 표현할 수 있다.",
      "since와 for를 시작 시점과 기간에 맞게 사용할 수 있다.",
      "just, already, yet을 문장 종류와 의미에 맞는 위치에 놓을 수 있다."
    ],
    "summary": "과거 사건과 현재의 관련성을 현재완료로 나타내고 시간 부사로 의미를 세밀하게 구분한다.",
    "patterns": [
      "S + have/has + past participle + since/for + time",
      "S + have/has + just/already + past participle",
      "S + have/has not + past participle + yet"
    ],
    "examples": [
      "I have lived in this neighborhood for six years.",
      "Has Daniel finished the report yet?"
    ],
    "errorCodes": ["TENSE-03", "PREP-02"],
    "masteryRule": {
      "quizAccuracy": 0.8,
      "productionPass": true,
      "errorTolerance": 0.2
    }
  },
  {
    "id": "A2-G03",
    "level": "A2",
    "title": "비교급/최상급 + as ... as",
    "prerequisite": "A2-G02",
    "difficultyTag": "expansion",
    "canDo": [
      "두 대상을 비교급과 than으로 비교할 수 있다.",
      "셋 이상의 대상에서 최상급을 사용해 가장 두드러진 대상을 말할 수 있다.",
      "as ... as와 not as ... as로 동등하거나 다른 정도를 표현할 수 있다."
    ],
    "summary": "형용사와 부사의 비교 형태를 사용해 대상 간 정도의 차이와 동등성을 나타낸다.",
    "patterns": [
      "A + be + comparative + than + B",
      "A + be + the + superlative + in/of + group",
      "A + be + (not) as + adjective + as + B"
    ],
    "examples": [
      "This route is shorter than the highway.",
      "Maya is as patient as her teacher."
    ],
    "errorCodes": ["WO-06", "ART-02"],
    "masteryRule": {
      "quizAccuracy": 0.8,
      "productionPass": true,
      "errorTolerance": 0.2
    }
  },
  {
    "id": "A2-G04",
    "level": "A2",
    "title": "수량표현/결정사 확장",
    "prerequisite": "A2-G03",
    "difficultyTag": "expansion",
    "canDo": [
      "긍정문과 의문·부정문에서 some과 any를 구별할 수 있다.",
      "가산명사와 불가산명사에 맞춰 many, much, few, little을 사용할 수 있다.",
      "수량 표현에 맞춰 명사의 단복수와 동사 수를 일치시킬 수 있다."
    ],
    "summary": "명사의 가산성과 문장 맥락을 판단해 수량을 나타내는 결정사를 정확히 선택한다.",
    "patterns": [
      "some/any + plural count noun or uncount noun",
      "many/few + plural count noun",
      "much/little + uncount noun"
    ],
    "examples": [
      "We have a few chairs but very little space.",
      "Is there any milk, or should I buy some?"
    ],
    "errorCodes": ["ART-03", "SV-04"],
    "masteryRule": {
      "quizAccuracy": 0.8,
      "productionPass": true,
      "errorTolerance": 0.2
    }
  },
  {
    "id": "A2-G05",
    "level": "A2",
    "title": "조동사 must/have to/should/may/could(과거능력/가능성 구분)",
    "prerequisite": "A2-G04",
    "difficultyTag": "expansion",
    "canDo": [
      "must와 have to로 강한 의무의 출처 차이를 나타낼 수 있다.",
      "should로 조언하고 may와 could로 가능성을 조심스럽게 표현할 수 있다.",
      "could의 과거 일반 능력과 현재·미래 가능성 의미를 구별할 수 있다."
    ],
    "summary": "의무, 조언, 능력과 가능성의 강도에 맞춰 여러 조동사를 선택한다.",
    "patterns": [